Kent Hovind is a slimy, uneducated, hack. His only education past high school is a degree from an unaccredited bible school. He is also a liar, since I just can't believe that anyone could be so stupid to say some of the things that he does. Of course, there are other people that are so stupid that they actually believe him.
And if you rewind a little over 40 years, the exact same thing could be said about interracial marriage.Archie's reply is a non-argument, and false at that.Multiple other groups state discrimination in marriage, but there are LEGITIMATE STATE INTERESTS prohibiting their marriage.Little things like child rape, lack of consent, and other issues.
It's quite obvious that it's the ID proponents who have issues with definitions, particularly among themselves. Behe has changed his own definition of IC, and Dembski changed Behe's definition of IC.
I'm not surprised.   That's a typical response when someone calls your bluff.   Waxy
Because their axiom is that the bible is infallible, so any problems with reading it are the reader's fault, whereas yours is that contradiction implies error. What Ken's saying is that we can't draw a distinction between your axioms and those of a bible literalist in terms of which is 'right', because axioms are stated not proved: axioms define what is 'right'.To reiterate: his error is in forgetting that the universe operates according to its own axioms, whatever they may be, and we can judge whether or not our axioms are congruent.
But you haven't looked. You may claim that your god did it, and no evidence to support or deny that can be offered. The assertion relies on miracle and has no suporting evidence. But when you start talking about how your god did it, your claims can be debunked by facts. Certainly the mythology of ancient nomadic herdsmen is not accurate. If you look at the world and the history of the world the is evident in the geologic strata, then you can see that the earth is very old, and you can see a succession of organisms through time. When considered with other fields of science from genetics to biogeography to physiology and anatomy, evolution becomes apparent.
Nobody should be forced to even have a sonagram. I think that you'll find reasonable pro-life and pro-abortion people believe that much.
What basis do fundamental rights derive from? In other words, how can we tell whether something is a fundamental human right?
Now you're playing word games to confuse people. Page 11 of the Heller ruling stated that the definition of "arms" include all modern forms of bearable arms that're in common use. They didn't rule on machineguns because they weren't part of the case.
Well, I don't believe in evolution. I believe in things for which I have no evidence. And while it is true that everyone has bias, using correct science and the process of peer review works to eliminate. Not all is perfect, and people are people, but overall the system works. Not a lot of bad science gets through. In the case of "creation science" we know that there is no science involved. Only talk that sounds scientific. There is no hypothesis, prediction or testing. Only ad hoc stories constructed of selected bits of evidence to support the foregone conclusion.
**True, and the confusion was my bad, as explained already. However, the fact of revertant mutation in eusocial bacteria colonies, as demonstrated by Ames and by Cairns, still shoots great big holes in the darwinist assumptions arising out of your old war-horses, Luria & Delbruck '43, and its "clone", Lederberg and Lederberg '52.
I believe you have even debated that it is conditioned into humans to be religious and therefore it validates religions. So why is there a need to debate whether animals love if they are acting on a conditioned response?
And yet you can offer nothing to show it's impossible! It most certainly is a plausible explaination! Fairytale?!? Don't think so, a logical path for the developement of the avian lung.
I see, when you say "I'm not an expert" do you mean you aren't a climate scientist or do you mean you don't have the scientific knowledge to discuss this?
That's NOT the equivalent of ID - you're mixing causes & effects. The theory of evolution, and the theory of intelligent design would equally observe, measure, and publish the effects of the apple falling. Then the evolutionists would say that happenstance origins caused gravity to work that way, and ID proponents would say that a supernatural design caused gravity to work that way. Students shouldn't have it implied to them that happenstance origins are the only possible cause of gravitational behavior. Your "apple falling" scenario is a simple one - the original cause of gravity has practically no impact on how we observe and deal with it's effects. Other scientific subjects aren't that simple. 
And you've been failing miserably, partly because your definition of "atheism" is asinine. Even most Christians would disagree with you.
The concept that science no longer looks at animals boggles my mind. My brother is a wildlife biology major in college meaning his primary focus is......looking at animals and their relationships to one another. It is somewhat understandable that your misconception could arise because molecular biology and genetic engineering are the latest crazes in science. The simple fact is most of the big breakthroughs when studying whole animals have been made. A similar turn has occured in chemistry. I could argue that chemists have subtly turned away from chemical reactions. All the research now is about electron orbitals and nano-structures. The reason for this is these are new fields that are relatively young and many scientists are interested in them. I myself am doing research on buckminster fullerenes. It doesn't mean we've abandoned good old fashioned reactions, we just have more field to play in now.
Really? Why? Bacteria don't need to see to exist. They don't depend on light to live. In fact, bacteria thrive in dark, moist areas. Why would natural selection determine this ability as being advantageous? If populations of bacteria with the ability to sense light are "better suited" than other bacteria, how many different types of light-sensing bacteria are there? 
I know it's almost as silly as thinking gay marriage will undermine heterosexual marriage.
my my you are up on the current events. Thanks for shedding light on this for everyone here.
Here is what fascinates me about the judgmental criticism you offer of my opinion. In typical fashion you make claims which you don't support at all. Here is my post below, point out WITH EVIDENCE!!! what I am distorting in any way; especially that which I hold dear. In other words, write a cogent and rational post which makes sense when applied to the quoted post it intends to attack. emoticonXDonno
Really Brady. It is widely recognized that Mr. Heston gave away a very promising film career in order to take such an unpopular stand at that time. In fact he worked very little in films after that. I think the above statement was a political one, an anti-gun one, without much fact to back it up.I don't think a man of such principle changes his mind when all he actually work to accomplish comes to pass. But you can push your poison just as far as you want to. You have a first Amendment right to do so. Mr. Heston would have wanted it that way!
Actually, there is no such thing as "an evolutionary mutation of a gene." A mutation is a mutation. For evolution to have occurred requires neither that a mutation be new nor useful and they don't require new structures nor structures.Here's a little mental exercise for you. At most, a person can have only two alleles for any gene. This would have been the condition of the human race 6,000 years ago according to creationists. It would not have been possible for there to be more than 2 alleles for any given gene. Now consider that for every gene in the human genome there is an average of 14 different alleles, sometimes more, sometimes less. Where did all of those alleles come from?
But if the repeated tests just confirm the same errors or misinterpretations of the results, all of the independent reviews in the World wont make a difference.
Actually, I pulled the number out of the air for illustrative purposes only, but after reading the CBO report, I see that I wasn't far off. They predicted 600,000 gay couples would want to get married it allowed.
So every woman who has an abortion lives an irresponsible life. Care to give any examples, or are you just spouting rubbish with no experience or knowledge whatsoever?
So you know how foolish you are and hope that name calling will distract from that being recognized by everyone. Erectus skulls were smaller because the brain was smaller. You brought up KNM-WT 15000 (Turkana Boy) and you weren't even aware that as an adult he would have been about 6'1" tall? Why is his skull smaller than modern humans?
You could've just as easily revived the last thread, commenting on how the antis are unusually silent.
Because Apes, monkeys and chimps are on different paths. You wouldn't expect a shark to evolve into a barracuda-like animal. things evolve to fill niches, we currently fill a niche, there is nothing pushing apes, chimps or other primates to fill a niche that is occupied. 
But a slightly larger brain than average is still feasible and offers enough of a benefit in a large social group that its worth the price - however something the size of a modern humans brain is far too demanding. That slightly larger brain can be supported by an organism or society that hasn't developed fire, but is also able to discover the uses of it, from then on nutrician isn't the big limiting factor that restricts how big a brain can get from then on. 
Well regulated as in the second amendment does not mean regulated by the government, it means well equiped and prepared. The framers of the constitution often spoke of a tyrannical government and how to keep one from coming to power, so why in the hell would they have said lets just give the government total control of guns. Your definition of well regulated makes about as much sense as adding another day to the week.
Well, since you have natural selection completely wrong, it must not go too well with the Biblical account. By the way, now you have introduced another word that has no meaning in the context. What is a "kind." Please be specific so that I will be able to recognize a "kind." Please show why a "kind" only has the ability to lose information.
And that is different how? I told johnny to write that I'm infallible. Therefore the book that I told johnny to write proves I'm infallible. There is no difference.   You do realize that there are other religions out there? That science is constantly updating?   Your arguments have been nothing more then false dichotomies assuming there are only two choices despite history laughing in your face.
It's the first couple of paragraghs from the article in this weeks NS. If you had an online subscription or got a copy from your newsagent you could read the whole thing, unfortunately with this one the intro rambles on a bit and doesn't get to the point till the second column...
See above. Whether a couple is or isn't monogomous is not for you to determine or worry about. And speak for yourself if you don't mind. This member of the American public's mental health is just fine thank you very much. If gay marriage impacts YOU that much, well that sounds like your problem.
Nice raising the bar. Fallacies are a creationist's best friend. You claimed:"have never shown to add any new structure or even a new part to any existing structure."Now you are changing your argument away from structure as new proteins and especially enzymes (which are proteins) don't count.
No! At conception we are a person and human.All living things belong to a species and the foetus is a living thing, for that reason a foetus must belong to a species, and that species is human.A fingernail is dead so cannot be considered a living human, nor will it develop into a human.The sperm only has half the chromosomes so is not human.The unique human is the key element here, if you cut your nail, the DNA from the nail can be replicated by the living persons nail, a foetus when destroyed cannot have itself replicated, the unique DNA that is destroyed will never be see on earth again, that individual has gone forever, howver, the man with the nail clipped is still alive.
True, they can change laws if the are unconstitutional. So what makes a ban on abortion unconstitutional?   Also, what makes the dealth penalty for minors constitutional one day and not the next? In fact 15yrs ago it wasn't an unconstitutional decision. I guess now it is??? Makes no sense.   Clive14,   those are obviously not my beliefs as I think everyone is equal.   I am not sure your wealth makes you different from someone else. It means you wealth is unequal..we are talking about just people. We all end up 6 foot under (so to speak) in the end.
I think this is a bad way to put it...the evidence that they earth has been warming since we have had the ability to measure temperature is overwhelming...the cause is unknown and whether or not it is natural is unknown. It does seem fairly narasistic to think in 100 years we have caused so much damage to an earth that at least has been here 10,000 years.
Possibly, depends on what you read and by whom. Still, the war wasn't aganist slavery.
Heart bypass, prostate cancer.......I have a couple of Canadian friends who needed those surgeries and one was told he had a 4 month wait and the other a 6 month wait so they both came down to Bellingham Wash and had the Surgery within 2 weeks............
I never said they would actually follow it all the time. I said that most would incorporate it (referring to a world morality). Just because they would accept it doesn't mean they would follow it. Maybe you should stop trying to tear down your little strawmen.
I see your point, Iangb but I'm not about to be leaving before you've had a chance to respond. I won't be "leaving" at all. You challenged me to produce an argument, so I'm going to produce my argument. I will then summarize the argument, and you can respond to it and we can then discuss / debate those specifics that you have a problem with.Truthfully, this is how I should have first responded to your challenge. Doing it piece meal has only resulted in a less focused debate.--Chuz
Yes, it is, and I'll gladly excuse his grammar compared to my zero ability in Hungarian.
Because self-defence, unlike most other 'reasons', automatically allows all citizens firearm access, and in most cases allows firearm acess without mandatory training/evaluation. When this occurs, you are much more likely to get misuse of firearms.If you read around you'll see that I consider all rights as needing justification. This comes both from my stance as a relativist and as a UK citizen, where there is no formalised Constitution. Ask yourself this - if a right cannot be justified, why should it be treated as a 'right'?
people keep saying thats the law in texas,so Im saying that this is the law in New York,He broke the law so he had it coming,next time dont disrespect the law and get a license,Im just showing how some of the people on this board are major hypocrites,you suddenly get all soft on crime when you dont like the law,
But the responsibility does not end with the woman who experiences the pregnancy. If it did, then men would not be required by law to pay child support.
You lie. You keep saying the same things over and over again, that doesn't make them true. Your addiction to violence is showing.Tony Martin shot an unarmed 16 year old kid in the back as he was running away. That's not self-defence, that's cold blooded murder.It is not the role of individuals to exact revenge for crimes committed against them. You don't get to take the law into your own hands. Munir Hussain ran after the intruders and beat them up with a cricket bat in the street. That's not self-defence, that's revenge.
I disagree for the same reasons I have been giving all along. There may be some legislation that was passed that has kept corporations small (Anti-trust) but did it really benefit the society?
True, but I was referring to psychological explanations, not genuine reasons.
I don't see how this is not a debate about abortion. True, it's become mildly less concrete, but that's what happens when you try to get it right.
actually they probably drifted much faster than that.....probably upon a pole reversal.
Well, it seems to me that if you have a reflex it means you have an at least partially developed and functional nervous system which would tell me that you can feel pain.
If you truly believe this then I think you need to re-read your posts and put yourself in the shoes of those on the receiving end. 
So, this statement is from a 'law center' that is dedicated to defend the religious freedom for CHristians. Yet, this isn't about 'religion'. Why do I find that hypocritical.
You don't even take into consideration the possibility that Japan could have a higher mass murder rate- perhaps the same as the US- if guns were freely available in that country. You have a lot of explaining to do if you expect me to buy what you're trying to peddle. 
Really? The transcript shows that he did not ask her anything in the Gay marriage section of the discussion.Transcript can be found here: http://elections.nytimes.com/2008/pr...al-debate.htmland here: http://www.cnn.com/2008/POLITICS/10/...ipt/index.html (click on the same-sex benefits section and the transcript shows up right next to the video)
well yes that's what he did, but he did not try to present this as positive evidence for anything. the biomorphs were used to illustrate the point that random mutations are much more likely to produce beneficial results when the mutations are small. analogies always break down at some level, this analogy was used to illustrate a certain point. the assertion that dawkins was suggesting that a biomorph happening to look like a real life object were proof that evolution and natural selection could produce such creatures is false. montalban, to restore integrity i suggest you retract the conclusion you drew from snippets and quotes from dawkins as your paraphrasing was clearly not representative of dawkins' ideas.
I think you're mixing up socialist and fascist. Patriotism is anathema to socialism.
Yes, to follow his commandments to love God and to love one another.
There is a pretty huge difference.Civil unions aren't nationally recognized, for one thing, since not every state has them. If you travel to a state that does not offer civil unions, then your union is not valid there.I think there's a problem with dissolving those unions as well.The big difference, though, are the rights that these unions provide. There are over 1,000 legal protections and rights that marriage provides that civil unions don't. I'll try and find a list of differences.
Pretty good considering Darwin wasn't aware of genetics. Too bad Wells is stuck in 1859. The modern synthesis provides perfectly legitimate mechanisms.
HA wouldnt you say someone who is really overweight actually has more of a problem with stress on their joints, muscels, heart, and bladder than a woman carrying a small child in her womb? Obesity can demand major scarifices in behavior and diet. Some of which can be detrimental.I really dont see your point because this isnt just a woman's problem when it comes to these issues you pointed out.And im not really sure what a "pregnancy" is according to you.. please explain.. When i hear the word pregnant, i think of 2 people, not just 1.Also, the baby has its own blood, its own immune system, and contains its own calories once consumed. theres nothing that the mother has that the baby doesnt other than it just needs nutrtion. Just like you need food everyday.
Cases v United States, 131 F. 2d 916 (1st Cir. 1942), cert. Denied sub nom., Velazquez v. U.S, 319 U.S. 770 (1943). Basically, The US Curcuit Court upheld that the Second Amendment didn't apply to weapons that couldn't be carried by an individual.
Butwhat of the fetus/babies that were wanted by daddy but not by mummy what does termination stop then?
Well I'm glad its no problem for your son. No child deserves to be harrassed.
This is more of a legal question involving whether or not it was negligence(sp). If so, you can't really sue for amounts of money you MIGHT get in the future. He could sue for lost pay on the job and other medicial procedures. So ya know :). I don't really know what the question is.
So you're saying that the theory of evolution is similar to ####, in that they both make large messes when they come into contact with fans?
Yes, because its THEIR decision, its THEIR stomachs, and its THEIR lives. I agree that some decisions do need to be made with parental consent, but not this one.   Irrelevant. How does purchasing a house have to do with abortion?   Ok, so what if the kid wants to have the baby and the adults want to get rid of it? What if the adults want her to have the baby and the kid wants to get rid of it? You would force the kid to have a child (that doesn't seem responsible at all), or you would force the kid to abort her child (thereby taking away her son or daughter). Both of those decisions don't sound very consitent or responsible. The decision is best left up to the person that is pregnant, regardless of their age.
Actually you are incorrect. The most commonly used rifles on the competition circuit are so-called "assault weapons".The "assault weapon" moniker is a term just recently fashioned to describe a military looking weapon.There are several target competitions designed solely for these types of rifles.
Yes, the Byzantines are a Catholic Rite. The Catholic Church is divided into rites- there are seven I believe, the Roman, of course, being the largest. The Byzantine Catholics are an Eastern Catholic Rite, and as you said are almost identicle to the Orthodox Churches except that they acknowledge the Pope as the head of the Church.East to West, a website regarding all the churches of the Catholic Church, especially those of the east.Real quick, the Orthodox acknowledge the Pope as the successor of Peter, but not as the head of the Church. Am I correct?
I would be interested to see where I made such a claim. Prove your assertion.
You do realize that the rules are supposed to be absurd, to point up the absurdity of a recent court ruling, right?
That is what supersport is hoping to do... However, assuming that you are correct in your interpretation, he has no chance of doing it so well.
I believe it is merely all known living species against those known by the fossil record and extinct. There are undoubtedly more extinct species that we are unaware of than living ones.
It is not only supposedly "junk DNA" that was used for these kind of arguments. The vertebrate eye has been preached to be a bad design. Why? Why is it a bad design?      The human eye contain bona fide optical fibers to conduct light (nice illustration). B
From my first post, starting with the quote from the religioustolerance website;
And folks that refuse to see the legitimate ones put us all at risk. Touche.
Yes. It's not logical to simply cite, "the Bible tells me so, the Bible was written by God," and consider that an argument. The Bible has been wrong. It's also not logical to cite authority to God. It necessarily begs further questions about your God's unproven existence to those who don't believe in that God, or in any God. If we don't simply believe in your God, on the basis of your presupposition, he can have no authority over the rest of us. One must come up with another argument.Should each religion have it's own definition or completely different idea of logic, which favours that religion and its God? 
"He" is real to all of us fjp, whether we acknowledge Him or not, God is alive and well on Planet Earth. And the day comes for each man when he faces that reality. For some of us it's a long awaited day of joy and for others a long dreaded day. But believe me when I tell you that just because one denies that God exists, it does nothing to lessen His reality.
No it doesn't. First, the changes may not be neutral. I will presume that you are intelligent enough to grasp that idea the mutations in and of themselves are neither advantagous nor disadvantageous, and the they have no purpose. Evolution happens when the mutations (and other mechanisms that increase genetic diversity) are acted upon by other mechanisms of evolution. Even in natural selection there is no purpose. Natural selection is differential reproductive success. Some organisms tend to produce more offspring because they have characteristics that give them an advantage in a particular environment.
so we would penalize financially those who want to have kids?
If your friend is hearing voices in her head to walk into traffic, she needs some psychiatric help.
Being in the minority or in the majority is irrelevant. Belief has no bearing on reality.
Yes, it is very hard, even for theologians, to explain.
Actually the details of HOW embryogenesis proceeds is becoming increasingly understood. And it goes way the heck beyond speculation. Check out how homeobox genes work and how regulation by master switches is understood as just two examples.
Why would that even be expected? When you consider that it is important to maintain some sort of consistency in study populations, obvious mutants are excluded from the breeding stock. And yet, there are frequent observed mutations. In fact, my elder son once observed two mutations in a single fly in one of his populations. One fly had no wings and white eyes.
