Socialsim and Communism in the Soviet Union failed because the USSR spent its entire existence recovering from war. The country was bombed to hell by Germany twice, around the time of the world wars. The united states put unspeakable amounts of money into their war machine, which forced the Soviets to do the same. I, for one, would buy a gun If I knew my neighbor had six, and he wanted me dead.The CIA and American military carried out immoral operations in 60+ countries since 1945. The soviet KGB, as far as I know, has only been in Germany, korea, China, and Afgahnistan.
If we bankrupt the country, the war on terror won't be the reason. Wasteful domestic spending is the only reason we have trouble funding the war on terror. We need to get intellegent with domestic spending. We could start with the $7 billion EPA.
You do have a problem with this person defending himself or you would not be attacking him. Fear made him do this. The fear was created in him by the buglers.   You want unarmed passengers to attack armed terrorists on airplanes, but you have a problem with a home owner killing buglers.
And just how are the criminals and terroists to be kept from entering a school while armed? Airplanes, probably with some of the new technology, but schools, or bars, or post offices, or government buildings? Just a law that says it is illegal, surely is not going to work. emoticonXDonno
Yes, do you? It's in a country with no medical facilities, no sterile place to get it done. A country full of HIV and AIDS. I wouldn't be surprised if these mothers had HIV/AIDS and knew they'd leave their child an orphan.
I know of at least 3 personally, including my brother. He fought for custody for years and it nearly bankrupted him. He was trying to get his kids away from an ex-wife that would go away with her boyfriend for weekends at a time and leave their 15 year old daughter in charge of threee younger siblings. 
Yes, but all concepts of right or wrong are subjective.
What I've been saying here, and after awhile - the guilt, depression, etc - will get buried, deeper & deeper - but no negative/damaging experiences leave people. They stay quietly in the background-computer base -until, as you said: Hopefully, the person "finds some way of forgiving themselves", right. But what about in the mean-time? - And we know, from research & quite a number of Healers, that rot (inside a person) is damaging... and often in very unsuspecting ways.Much better to life benevolently, in the first place.Annie
What does adoption have to do with being pro choice or life? I thought that the waiting list was years and years long to get a baby. (Not trying to argue, just don't understand)
Because there are still a lot of people in this country that support oppression and injustice toward gay people.
It is 'change over time', not 'gradual change over time'. The morphological changes tend to happen with a change in the environment. The difference between 'micro' evolution and 'macro' evolution is the number of steps. "Macro" evolution is a bunch of 'micro' evoltultions that add up. You have two populations that you can compare that used to interbreed, and for some reason, do not, and then you add on a few 1000 'mircro-evolution' events to each, they become very very different.
Origins of science, whether truly started by those of faith or not, is irrelevant. Whatever science was, it has become a body of knowledge, through application of reason.
Mach, your ability to make the wrong argument on the wrong post continues. I ask a question of this person, you reply not to them, but to me, and with ad hominem, and a 'just-so' statement.
Not really. That's the fallacy of exclusion of the middle. Because there are only two choices, if one is wrong somehow, the other is therefore correct. The problem is that there isn't only two choice for sure. Besides, science is wrong all the time, it doesn't prove that creation is right. In fact, for instance, science estaimtes of moon dust have been proven wildly wrong, and those corrections actually harm creation. 
I've always gone the Scylla and Charybdis route before instead.
Exactly. Moreover, in Emerson the discussion of the 2nd Am. is dicta (arguments not pertinent to the verdict) so it is not a binding precedent even for the courts in the same Circuit.A question for the "original intent" crowd:What did the Founding Fathers intend with the misplaced comma in the 2nd Amendment?
What this highlights is that the laws of the land are ignored and some people try to place the blame on the victims.
I don't think we have any business forcing anyone to do something they don't want to do. The father is supplying his DNA when he engages in sexual relations. After than point he has in effect signed a blank check. It's like the old saw, if you don't want to do the time, don't do the crime. Fathers to be shouldn't be engaging in sex unless they intend to pony up with the montly check. I come from a bit of a bias on this subject because this was my area of endeavor for some 20+ years.
In some cases yes, in others no. If the mutation gives a huge advantage, then there will be a decline in the size of the gene pool for a while (eg when the Australian rabbit population was reduced form 500 million to 100 million by myxomatosis, the gene pool strunk as a result and the genetic "mutation" that gave increased resistance spread throughout the whole population as a result). Most of the time though single mutations do not have such a huge advantage and so genetic variation is maintained.
The counter arguments put forth by its critics do not defeat the Violinist arguments, at the very least. Whether one accepts the argument anyway is another story :P
I believe you are thinking of orders, not denominations. There is a big difference.   Strict and loony? Could you be a little more specific, because this statement sounds like it's coming out of complete ignorance.   You also seem to be making the assumption that all of the non-Catholic Christians are somehow very similar, which couldn't be further from the truth.
Well, there's also carbon dating... Didn't you post something about a decay curve? Are you now going to deny the accuracy of that?
We don't live on carbon dioxide. We live from the energy stored in carbon compounds when we break them down.
You either did not read my post thoroughly, or are intentional misrepresenting me. Post 250 (which I had actually read before starting this thread) is nothing but DamEtel rambling about homologies between vertebrae embryos. That has absolutely nothing to do with the unexplained homologies that the Denton talks about. Evolution simply cannot, reasonably speaking, account for the homology between your arm and leg, among other examples.
No. We know that evolution happens. What would be a problem would be to find the processes that made evolution happen as such incredible rates. There isn't any evidence that it can happen that fast.
Because there is no evidence against the virgin birth and there is considerable evidence against Adam -- including the text of Genesis 1.
Little boy, you need to do a little study on Nazis. They specialized in death. Unlike pro-life people.
And yet, for most pro-choice folk on these forums, this question really is meaningless. For, even when it is assumed by these folk that the embryo has rights, they nevertheless argue that abortion is still acceptable. Even you believe this Shooter.
Well then quit trolling, and start debunking the BS by providing links to cases that were solved by having a gun registry in place.
From a book review of BETTER FOR ALL THE WORLD: The Secret History of Forced Sterilization and America's Quest for Racial Purity by Harry Bruinius:http://www.nytimes.com/2006/02/26/bo...w/26satel.htmlHmmm, Teddy Roosevelt, Winston Churchill, the Rockefeller foundations, millions of Americans, the State of Indiana. . . all these embraced the concept of EUGENICS.Interesting, yes?
You contradict yourself. If the earth was then much as it is today, then there isn't enough water on earth to cover it in any fashion. I have done the math. Do you have any idea of how high the Himalayas, the Alps, the Andes, and the Rockies are? Besides, the Bible talks about a flood that lasted a year, not a series of tsunamis.
In older times man had more questions without answers than today. Some men believed if a God of fire because they did not understand what fire was. Because of their misunderstanding they invented an answer, the Fire God. Today we know exactly what fire is and we don't need to invoke some mythical explanation. Today's atheists know that there are many other questions we don't have answers for and it's OK to simply say we don't know instead of buying into the whole "let's-invent-some-god-to-explain-it" mentality....
Come on, people. You don't butcher an innocent baby for the conveience or sins of the parents. There's plenty of people in the world who would have adopted that baby. And if no one else would have, I would have.
Why don't we do the same for straight marriages then?Why doesn't a straight couple that gets married in Colorado, and then moves to Virginia, have to get their divorce "remotely" from Virginia.Or maybe you should start thinking about what AUTHORITY Colorado has to grant a divorce to Virginian RESIDENTS.
Actually, the answer might depend more on the nature of the question, or the particular religious cult of the person being asked, etc. In questions of science, fundamentalists will tell you that the answer was revealed to them by their god in their holy scripture.On the other hand, you are characterizing religion as insanity. I think that you really mean that when religion is offered as science, then that is insane.
Well . . . one could make that argument about anything--voting for instance. Amendments are created by voting, and people and legislatures vote (hopefully) their conscience (and the will of their constituents), even if they are religious. I think this is a different matter than, say, displaying religious icons on courtroom walls or grounds, which is a clear endorsement of religion by the government. The 18th amendment was religion-motivated, but it didn't get rescinded for THAT reason. It got rescinded because it didn't work practically. (and because FDR wanted to see the returns on the economy for his New Deal)
Exactly. It is their fault, but they can do what they choose. It is punishment and you know it, and it is not your job to make sure no "irresponsible" pregnant woman goes unpunished.
You do not have a right to drive. No one does. Driving is not a right. The state does not owe it to you to give you a license to drive. The activity of driving is a priveldge granted by the state, not a right.Rights are not regulated by government. You have them and no earthly authority can take it away from you. The state never gave me my rights, I already had them, nor do I have to ask for permission to exercise them.
I believe you, OTHERS pick and choose what you believe. What is sad is how many lose their faith when they find how much they have been mislead.
This stat sounds more than a bit inflated. Seeing as it comes from a website called "women's issues" it is probably not all that credible.
And evolution is exhausted. It can't do anything with origins, and recent discoveries of the complexities of the simplest forms of life exhaust it even more.
Well he has further political aspirations..........The 9th circuit in Sodom (SF) is always making law instead of interpreting it........That is why they are over ruled so often.......
Well let's see . . . the last time a state started recognizing gay marriages, suddenly there was more support for a Federal Marriage Amendment than ever, Democrats lost more seats in Congress, the minority Democratic leader was defeated after years in office, a protestant presidential candidate carried the Catholic vote against a Catholic candidate, evangelicals in the country were energized, the pro-FMA candidate WON re-election even though his approval rating was 50%, and the state that recognized gay marriage fell under a slew of legal challenges to the point where it's up in the air again.The more you push you agenda through activist judges, the closer you get to the people having to pass an amendment. At least New York was smart enough not to do it right before an election.
It can go both ways. We all doubt. It is what you do with it that matters.[QUOTE=gnojek]If a child grew up never hearing the words religion, gods, spirits, etc. would this child still have faith of some sort?Is faith some innate human tendency?It could be seeing as how there is the "god spot" in the brain, but maybe the god spot wouldn't develop as fully in the child that was never exposed to religion or thoughts of the supernatural.QUOTE]Look around. Faith did not spontaneously generate out of thin air. It is obviously part of our psyche. Every civilization throughout history has felt the need for some type of faith. Even on different sides of the planet.It's as natural as the sun rising.
Well, those who keep using that story can't see the real sins of those cities. They are so sure that it was rampent homosexuality which lead to their destruction. Even though we know that before the Angels were ever sent God had spelled out why he was going to destroy them. He sent the angels because they promiced to find even one righteous man. They failed in that because the angels were attacked for being foreigners. Noone who abuses this story is ever going to admit this fact. They can't see past the supposed homosexual issue.
Thats true. However, do we not have a state of reasonable compromise at the moment?
Yes, I would stay out of it, unless I knew the woman, and she spoke up and asked me for an opinion, or advice. And even in the case of the woman being my best friend, and knowing all the different aspects to the situation, I still would not feel comfortable weighing in. Just like if it was me in the situation, I know that ultimately, it would be my decision, and I would have a right to that decision.
No nation is perfect, Rev. Not even the USA! A singular instance that you quote is not an argument as anyone can just as easily find criticism with the USA over people freed early from jail.You will find black people over-represented in the jails of the UK, the USA and Australia. There is injustice everywhere.
For a 13 year old girl that could greatly damage her body to have a pregnancy so young. She is just starting to grow and mature, and its not healthy, natural, or right to have a pregnancy at that age. She could cause alot of damage being that young.
But pro-lifers often base the pro-life stance on preventing harm. Not just religion. (And in this case they are one-in-the-same anyway.) This isn't a case of harm-preventative-morality versus religious-morality; it's a case of two harm-preventative moralities in conflict, due to each only focusing mostly on one aspect (either the mother or the unborn baby).
Well if your claim is that you shouldn't push a gun owner's buttons and make them mad, then why are you arguing with me when that's what you're claiming is the wrong thing to do?
Oh dear, you're back to your nasty ad hominem self. I could have made fun of the fact that you don't know about materialism, and how its a major force behind evolution. Which is itself a suggestion that you are unaware of the socio-political forces driving western evolutionary theory.**The issue is about people behind sciences, making many different 'sciences'; based on bias, cultural/political/historical. 'Peer' doesn't mean anything because 'peers' are just people with the same background/bias etc.I notice you didn't touch upon Nationalist Sciences. Or for that matter, Capitalist Science.*You mean 'understanding' written English.**I say 'western' because there are other evolutionary theories - Marxist, Nazi, Feminist etc.Thank you, come again.
They do offer a good insulating blanket which would keep the body of the reptile warm which in turn, would allow the reptile to remain active for a longer period of time. This means more time to hunt and reproduce carrying the mutation onwards.
It is clear that the profetallifers wish to make the pregnant woman a slave to her fetus.
Bad Religion or misapplied Religion has been in every century, country and culture.
The fact that some scientists totally dismiss god is proof of there ignorance of scientific method. There is growing evidence to support the existence of a supreme being, and a lot of scientists are ignorant of this fact, yet they accept theories from the quantum level wich are not proven beyond the proof of the existence of god. Mayabe your mind isnt as closed as others I have spoke with on this subject. I do believe in scientific method, but I also have faith that god is out there.
So you're actually claiming that it is a lie to say that the UK has a lower gun crime rate than the US? Even if the police were miscounting crimes it's still a huge and unjustified leap in logic to conclude from that that the UK does not have a lower gun crime rate.
But behind that are deeper, more fundamental issues about what homosexuality IS and the morality of it. To many people who view homoseuxality as immoral, your movement seems to be trying to write immorality into law.
State courts can rule based on state and/or federal law. In this case, the answer was found in the state constitution, so the judge did not need to pursue the issue further.Also, a state constitution can offer more protection that the federal one, as long as, in so doing, it does not contradict the federal constitution.
It is horribly oppressive of women, though, to oppose both abortion and contraceptives. That means that women will have no control over their pregnancies at all.
All of these examples are scientifically recognized as human life with a unique genetic code.
As proved above by definition of reason above, it all depends on what premise or starting assumption you have as to what conclusion you will reason out. You are correct that faith does not neccessary require evidence. But there is usually always evidence to support the validity of a particular faith, in this case Christianity.
That is just conservative bias. Conservatives are just as guilty of the same things as liberals and then each has their own ideological idiocy that is unique to each group. Conservatives like classes and don't like change. A pure conservative society would fail just as quickly as a pure liberal one. The last 10 - 20 years as we have become more us vs. them the overall prosperity and well being of the country has declined. With both sides taking the country to extremes. Conservatives eased restrictions and corporations run wild. Those laws are in place for a reason. Liberals overreact and put a choke hold on growth. There was a reason for less restrictive laws, but now they can't do anything meaningful.
I don't know if you ever heard of the UK Poll Tax but I could have seen myself protesting by non-payment against such a grotesquely unfair system of taxation had I been of the age to do so.
Again, what evidence? anthropic principle doesn't have anything to do with creation. Puntucated Equlibrium anyone? How is symbiotic relations beteween plants and insects sign of creation?What are you talking about? A dog can't have a cat. That's retarded. What facts are you talking abot? 
Because in the case of glacial/interglacial variation, CO2 functions as a feedback from orbital forcing. Again, this is all very simple, basic stuff outlined in chapter 6 of the AR4.
Because when something passes every experiment thrown at it and when something fits observation better than anything else, then it's as near as damnit fact. We can get pedantic over this if you want, but the conclusion that reaches is that there are no facts.
And that is why they are wrong. They don't understand science. Science is not the presentation of proof but explanations of the evidence that have been tested.
Either a gross misunderstanding or a gross misrepresentation of evolutionary theory.
so what about jesus' life is credible if the source is unreliable? was it that jesus didnt walk on water but he fed 5000 with 5 loaves? was it that he didnt forgive the samaritan harlot but he raised lazarus from the dead? what did the authors get right? i mean, i can easily believe jesus said he came to bring a sword and not peace. but you dont. so how do we possibly pattern our lives according to how jesus lived if we dont know whether what they recorded was actually what he did?it is necessary to believe that the gospels are true, otherwise you cannot follow a pattrn you dont have.
They have. Prey animals have their eyes to the sides of their heads which allows them to see in every direction, almost 360 degrees around. Predator animals have their both eyes facing forward.
Does any part of the theory of evolution give an accounting of how we transitioned from quadruped movements of the ape to biped? 
Does the sexual orientation of the would-be single parent even come up?
Yes, but our cells, are functional. It's cells are not yet functional beyond dividing.
Honest question Arch: where is the problem with a potential variance of 10 billion years? I know this question may appear ridiculous to you but could you take the question in the spirit it was meant?
And I'm going to correct you again. The theory of evolution is by no means an extreme view. It is the prevailing view. More than 99% of biologists accept the theory of evolution as the best explanation for the observations.
Given that I do not hold that opinion, I would challenge you show where I have stated such.
I think you have your image of an assault weapon slightly skewed. an assault weapon by its very name is a weapon designed to harm another human. this does not mean full auto it just means that it was never designed to be a target/hunting/self defense weapon.
"Ready to go", in the sense that living things are equipped with a means of making small errors which are used by natural selection to make new structures.Barbarian, regarding mutations:There is a lot of that. Many mutations are recessive and a population over time accumulates a lot of genetic variation that can become useful if the environment changes. The founder population of lizards, for example, could have had at most, 20 alleles for any gene locus, since each lizard can only have 2. The new ones evolved by mutation. Sometimes, we can even observe that happening, or trace the mutation back to a known ancestor. Would you like to learn about it? .
Actually "I don't know" is quite a valid answer in science.However, again you slip into this false construct of a belief that all that can be known is in the scope of science; which you've also denied saying you believe in the past.[quote=Montalban]Is this a rational statement? If so, prove it rationally, by science. 
Oh? And what do you consider yourself when it comes to gun rights? Are you moderate or fanatical? Would you actually declare yourself a fanatic or would you like to be known as a moderate?   I don't think any organization who wants to be taken seriously will declare themselves fanatical about their cause because that would take away from their credibility.
Listen, I have forgotten more than you will ever learn about what is real and true in this world, so either back up your insults with facts or get lost because It is becoming painfully obvious that attempting to reason with you is an exercise in futility. kind of like trying to travel from point A to point B on a merry-go-round.
Well sigma, which is more painful??   Being burnt with salene for 30 minutes to an hour and if that doesnt work after the 3rd time, being born prematurally and laid on a table and starving to death.....   OR   A woman sticking a clothes hanger up and accidentally killing herself but intentionally killing the kid within her?   seems to me that people dont really care about how the baby feels. It has just as much feeling as the mother.
Today's students are tomorrow's scientists. They are unlikely to study something that, if they hear about it at all, they hear about it on a less serious level than they do the happenstance origins of atheist evolution. To reduce ID to other classes like literature or social sciences, etc. (where poetry, fiction, and prehistoric beliefs are the subject matter) is nothing more than a clever, dishonest attempt to belittle it.
Many natural disasters such as tornados, destructive flood, severe drought probably have something to do with global warming.I don't know which is first regarding these combinations. Maybe flood is caused due to global warming, maybe reverse.These phenomena are related each other, so it can't be seperated when we think about it.Maybe global warming itself is not such a big threat but many disadvantages resulting from this are threats to us.
And how did the Wise Creator come into existence? All that wisdom and creativity cannot come to existence accidentally or spontaneously...
I think you got it backwards Kelvin. You're the one that said you wouldn't let your children play with toy guns because you're afraid that your children wouldn't be able to tell the difference between a real gun and a toy gun. Blindone never advocated toy gun-control. On the contrary, Blindone was pointing out that toy guns don't harm children.   And if your children can't tell the difference between fantasy and reality how do you expect them to handle a gun responsibly? They might try to shoot the boogey man or their own shadow.
You state "the woman comes first". This seems to be your only "absolute". Why does the woman come first? Is it because she is fully developed? Is she more important than the child she is carrying?
