Is it correct to assume that in the presence of the precursors of the standard genetic code (e.g. intermediates of glucose degradation and the citric acid cycle), the intimate relationship between these molecules resulted in the inevitable organization of the genetic code (global optimum of the system)?   Articles 5-7   These articles discuss fascinating mathematical representation of the genetic code. For example, in article 6 a representation of the genetic code as a six–dimensional Boolean hypercube is proposed.   Abstract:
President Obama has correctly characterized the Bill of Rights is a list of negative Rights against government.   The point is, that the only rights that the government, and or any anti-gunner, or department has, is the infringements we grant them through laws etc.   Taking the info in this article at face value. What was a legal practice to do just yesterday landed this guy in a jackpot for not knowing what or how the Govt. is going to interpret the law to mean today. This is a common problem with, and not to directly pick on the ATF, but gun dealers complain about this all the time. EVEN an FBI agent himself cannot predict, nor curry a favorable interpretation.   What kind of country and legal system do we want? Surely you can see that this kind of stuff is not in ANY WAY Shape of Form, fair to do to a Right that our Constitution says is Inalienable. Or to a person who was an impeccable reputation.   Would you like to be treated in this manner?   The article says, what he did is not illegal, but in the hands of someone with an axe to grind, maybe they didn't like him, or maybe the prosecutor is Anti-gun etc, lands this guy in a jackpot!   Now can you see the problem with this?   I know lets apply all of this to computers! We will just make up any law as we go. How'd that be?
When talking to a person professing Christianity, the Bible is binding. If the Bible advises that abortion is murder, then it is so regardless of what the secular systems of the day have to say about it.   When talking with one accepting the principles of Christianity, the premiere of those being that the Bible is binding, the existence of the soul is not up for debate.   The position of Bassman, I believe, would be that there is no legitimate right to terminate a pregnancy, especially from the stand-point of the Bible, which of course, is binding to those professing Christianity.
Good idea!
No, they do not. I know several people in England who posess weapons the bought on the street. How are the gun laws in england working when you can buy a machine gun?   Before the ban, england had lower numbers when it came to firearms related deaths. They also had lower crime numbers. The sociological differences between England and the United States are not be be discounted.   It is interesting to note that crime rates in England seem to be rising now that the gun ban has been around for a while. There is even a movement by public officials to arm police officers in response to the rising rate of violent crime. There isa n article and debate about it right here on the forums.   The biggest difference lately in the statistics in England in the US is not the numbers, it is how they are recorded. If a guy is confronted by three people outside a bar and shot to death, but the gus get off during trial, it is still recorded in America s a three person homocide. In england, it is NOT recorded. I get the London Times, and they have done several articles accusing th British government of manipulating crime figures. I think that if we in America only recorded solved crimes in our crime statistics, we might become one of the most cime free contries in the world!
Well, the claim isn't that they were identical, just that they preceded Jesus and were very similar.
So what we have here is a lie, based on a distortion, which is itself a fallback position from a fallback position from a fallback position from an evidence-free made-up graph about the magnetic age of the earth. And creationists say the truth is constant...
No Ted Kennedy is not a fundie but Vitter is. For God sake the pope is a nazi and a fundie.   Marlene Elwell, the nazi *itch, who put the evil mariage amendment on the michigan ballot is a Roman Catholic also. If you are a christian and you believe in the suppression of homosexuality then you are a fundie and a christianist.
The question is illogical. By declaring the existence of an all powerful God then saying God cannot do something is not a comment on his powerfulness but rather the direct representation of his nature. Your question by its very statement does not test wether or not God is all powerful but wether or not God is comprehensible. See another thread for that topic.   The statement that God is all powerful defines his nature. To state then that he cannot do something outside of his nature as proof of the non existence of his nature is circular in logic.
And an even funnier thing is it won't affect his wallet at all.
And, what percentage is that? How was the poll conducted? Who conducted it? How was the determination made about who was a 'scientist'?
No. You're missing the point. Al wants you to think all we have to do is stop emitting CO2. He wants you to fear something that he knows how to fix...so you'll give him prizes for being a genius and solving the problem.   Al Gore is a shyster...just like Michael Moore. Documentary, my XXX!   Tell me, what has caused the global warming on Mars?...Jupiter? I understand the temperatures there have been rising more in the past few years than before. Think it could be resulting from their industrial age?   ...and he's pretty much a hypocrit about what we should do. Check the stats on his personal home. Check the emissions rating of his antique private jet. He claims to be doing his part by leading a carbon neutral life...which means he merely paid for permission to continue polluting the earth with his inefficient means of private transportation and his energy sucking home.   He claims that sea levels will rise 20 feet or so shortly, yet he bought a million dollar condo near sea level in California.   We should all decrease what we spew into the air (and what we send to landfills). This fact does not diminish the lies told by Al Gore...the ones that got him an Oscar and a Nobel Peace Prize, both of which become more meaningless each year.   Gore, a shyster   http://newsbusters.org/blogs/noel-sh...d-return-oscar   http://www.globalwarminghoax.com/news.php?extend.29   1.
My recollection is similar to yours. I encountered it in an AP biology class in high school, we spent about 1/2 the extra-long class in labs (I think that was the primary difference).   The giraffe example was an "aha" moment for me personally, I suspected life changed, but the specifics I had never thought about.   I recall a disclaimer at the start of the section, but I don't recall the exact wording.   -Mach
You are getting to a more complicated area where "mental existence" no longer matters. I've explained earlier that it isn't exactly the same as "self defense" so I don't think a similiar response is needed. Furthermore, you are saying mental existence is not solely the thing that gives you value but rather it depends on outside influences and chance.   At some point it just seems like the stance on abortion is that the woman is more important no matter what. This is why I claim some will rank humans above other humans...a dangerous precedent which we have tried before.
But only if they're willing to receive one. Most aren't.
i'm impressed! this is a very precise description, in regular english   and yes, the deduction in 9 seems presumptious if all we state is God has a "possibility of existence". how this was cleverly cleared up (from the same source site) was simply a trip back to the definition: "greatest possible being". the "greatest possible being", by definition, MUST have a possible existence. in otherwords, we cannot assume that there is a possibility that the greatest possible being does not exist. yeah, it sounds like the whole "proof" is pointless because your premise is already the proof   just keep in mind that for the purposes of this proof, God is defined as "the greatest being possible". as long as that definition is maintained, the proof works...   does that mean that God exists? hmmm....
you know why? because God touches our hearts like nothing you have ever felt before. it is amazing
This makes more sense then anything else I've heard on this thread.
I'm not arguing that gun control will change the nature of men- though guns may make them more willing and confident to engage in crime. With guns criminals can do even more damage. Adding guns to crime is like adding gasoline to a fire- it makes an already existing problem worse. If you think that just as many people die from stabbing and beatings in other developed nations as people die from guns in the US then you need to do more research.
Yes, they do show a faithful devotion to the ultimate reality that there are no gods. You're an atheist, aren't you?
This also applies to tapeworms. I fail to see how it is therefore relevent to any debate on abortion.
So, your saying an eyewitness would mean nothing. Yeah right.
Well, not completely, but yes, quite the same. However, this is irrelivent- she wasn't a person, because she was in a coma. Does that give me the right to kill her? Of course not!   What about fetuses born in comas? Can we kill them?   What about people in vegetative states? After all, they arn't perfect, so let's kill them!
Oh. You just lost me. The fact is, Jesus warned his followers that they would be persecuted for his sake. Read Matthew 10:5-42, if you care for the full text. Basically he told them they would be beaten, thrown in prison, crucified, and put to death if they followed him. And that is exactly what happened to the disciples and all those who gave a witness for Christ as Lord and Savior.   The various Roman emperors in those years of the early church sought to kill every Christian they could find, men, women, and children. Christians were crucified by the thousands, covered in pitch, and sit afire to provide light for the emporer's lavish garden parties. They were killed in the arena by wild animals and tortured to death in numerous ways. They were called martyrs, which now means one who dies for a cause. The word is Greek and means “witness”. These witnesses for Christ were killed for their faith. How many Christians would we have today if they had to die for their faith? In spite of everything that the emperor did, they could not kill the Christians fast enough. More were believing in Christ every day, and eventually even the Roman emperor himself became a Christian and Christianity was embraced and sanctioned.
So he failed to follow procedure? So was one of the procedures to assist the child in holding the gun while the gun was being fired and to not stand at a distance? If that's the case then the instructor at the firing range was also partially at fault because it was also his responsibility to supervise the child. And I just found this:   "SPRINGFIELD, Mass. - Authorities in Massachusetts are considering whether criminal charges should be filed in the death of an eight-year-old boy who accidentally shot himself with an Uzi submachine-gun at a gun show.   "Hampden County District Attorney William Bennett says he hasn't been able to find any law that would authorize a child to possess or fire a machine-gun."   Criminal charges possible in boy's Uzi death, Massachusetts authorities say - Yahoo! Canada News   So not only is allowing children to fire machines guns irresponsible it may also be illegal.
Yes the facts speak for themselves, they just don't sing the song you think they do. No biologist will find any need at all to wave any hands in this instance, for as you say the facts DO speak for themselves.
Excellent point Doc
The definition of manslaughter is when one's actions, which end up killing someone, display a reckless disregard for the dangers of the situation. That's not a proper legal definition, but it'll do.   Now, you want to argue that pro-lifers would be forced into the counterintuitive conclusion that ALL miscarriage is manslaughter, and thus their position is ridiculous. I'm saying that they would only be forced to admit that a very small portion of miscarriage is manslaughter, and a portion that they would probably be willing to make a case for.   I'm not saying "miscarriage is not manslaughter," but only "miscarriage is not always manslaughter." For example, if a woman took perfectly good care of herself and did nothing dangerous, but had a miscarriage anyway, she would obviously not have committed manslaughter. If a woman had one drink with dinner, but she was carrying a very unhealthy fetus and it died, then she would not have committed manslaughter, because that was not reckless. I pointed out the "you-shouldn't-be-drinking-and-having-unprotected-sex" argument as a position somebody might hold, but I think that it would probably be judged as unrepresentative of the definition of manslaughter.   So obviously, miscarriage cannot be manslaughter in the sense of "every instance of A is an instance of B."
Technically, all syllogisms need two premises, first of all.   "Step two" and "step three" were a dilemma, not separate steps. Learn to read.   Dilemma:   You only read Scenario 1, which was:   step two -God can create a rock he cannot lift -   Step three - God cannot lift the rock   conclusion - God is not all powerful   Scenario Two was   - God cannot create such a rock   - Therefore, there is something God cannot do   - Therefore, God is not all-powerful   The only case in which God could truly be all-powerful is if he can somehow both create an unbreakable rock and then break it, which defies the Law of Non Contradiction and is thus absurd. Thus, the notion of all-powerfulness, which leads to such a notion, is also absurd.
So what's the deal when GWB "gives" $3,000 but the insurance premiums cost $6,000, the family can't make up the difference and the $3,000 goes unspent. All we've accomplished is to transfer $ out of the U.S. Treasury. You think it's a good idea to just give money away and not get anything for it? You're thinking of the Clinton years when there was a surplus.
Yes, every living thing is made up of cells.
We agree!   Excellent!
If your friend is hearing voices in her head to walk into traffic, she needs some psychiatric help.
You pointed out someone that had 6 fingers.   I said that making a copy is not creating anything new, I never mentioned anything about reproduction.
Can't argue with this illogic.
Well, I would agree that as many constitutional ammendments probably would not have passed, but I certainly don't think they all would not have been passed, and I don't think that Massachusettes allowing same-sex marriage was a bad thing. Constitutional ammendments are difficult to overcome, but no one can ever change a law if people aren't willing to take a stand and fight for it.   Can you tell that I love the quote in Jyoshu's signature?
Actually it wouldn't. Since there is no rational, believable evidence for creationism, it wouldn't be any more believable if evolution were disproved. As an example, I dare you to start a thread in an appropriate forum and give us tested evidence for a global flood as depicted in Genesis. Good luck.
Well, how else were they supposed to reproduce?
Well if you just shoot someone and they die then they dont get their day in court so they dont get due process. The fifth says you cant lose your life without due process.
Purposefully communicating information as a means to an end... wound healing.
The subject matter would be life forms. The units would depend on which particular aspect you were studying   For instance to the question 'what units of measurement would you use for the effect of evolution?   I would say genetic changes that have patterns.   ID would have that and more.
Said the troll that lives in the UK
Are you saying that given enough time you can come with answers? That's a statement of faith.
I may be a pro-gunner but what doe's that have to do with with gay rights?   Since I'm a pro- gunner I won't force my life style or views on you,if you don't force yours on me.Deal?   After all you seem to be the expert on gay rights.
Why do people on the pro-gun side continuously try to oversimplify the issue? No one is really arguing that there would be zero murder without guns. The question is would there be less murders without guns. In developed nations with stricter gun laws there are less murders. At any rate, I don't think you can draw such conclusions based on one incident.
A person going to Hell is a consequence of sin. God doesn't want it, but he can't stop it.
I don't believe Hell is a place either (or even if I believe in hell to begin with), but tell me more about what you mean by this. It sounds interesting.
actually they probably drifted much faster than that.....probably upon a pole reversal.
and section 6
After what the Fins been through, fighting the mother country, the Soviet Union under Lenin and then Russia and Germany and finally Germany, I doubt they are going to let their own government take away their guns??   Most folks have learned to leave those Finns alone.
The Brady Campaign whines more than they act. Making handguns legal in Chicago wouldn't make them happy. Sending the national guard in wouldn't make them happy. They don't have a solution for the problem, but they're right there to whine about it.   They're just like the Federal Government; they find something simple and complicate it.
Define "many". What you really mean one is too much. Even when the one is used soles for personal defense. Besides your in Austraila, no one cares what you think.
In point of fact, the low birth rate in most of Europe is not due to the availablity of abortion, but to good sex education and the ready availablity of effective contraception to everyone who needs it. See this study, for instance:   http://www.advocatesforyouth.org/PUB...heet/fsest.htm   People have small families because they want small families. In point of fact, the abortion rate in Europe is generally much lower than the rate in the US, due, again, to education and contraception.   Would you force folks to have children they don't want?
Unions fought to keep children out of work for the same reason they fought to keep blacks and women out of work - they want a monopoly on employment.
I don't have the time nor the funding to put this in video form like Harris and Dawkins. I don't think many, if any, Christians really do - satire about atheism isn't a strong Christian practice, not nearly as strong as atheist satire about Christianity, it seems. Maybe that's what made Poe's Law so notable in the beginning of this thread.
Well, actually society has said that 18 is the dividing line. It can then also say, that under certain circumstances, for a particularly bad person, in some cases it will be considered if the person is 16 or 17. That's why we have all the judges and lawyers, etc...
It is horribly oppressive of women, though, to oppose both abortion and contraceptives. That means that women will have no control over their pregnancies at all.
It depends on the particular situation. Some adoption agencies ask about it, and some don't. Most social workers who do home studies are aware that they have gay clients doing adoptions. Some adoptive gay parents are out about it, and some keep it quiet.   There are currently some foreign countries that require adoptive single parents to sign an affadavit that says, "I am not homosexual." Those are the rules of some foreign countries, notably China, not the United States or any state.   China has recently placed greater restrictions on prospective adoptive parents. They have sharply limited the opportunities for single people to adopt, and it looks like they may prohibit single-parent adoptions entirely. They have also instituted a weight requirement for all adoptive parents. In the case of a couple, their combined weight has to be below a certain figure or they are not allowed to adopt. No fat people allowed to adopt, which cuts out possibly most Americans.
yes, but adam wasnt created with hereditary information or from sperm and egg cells. adam was the prototype. any subsequent humans should be born following the fashion in which adam was made. otherwise adam could have been shaped like a goat and still bear human children, because god could have formed him into whatever shape or lack of shape he wanted, yet put the genetic information in him to produce human offspring. why should adam's children look like adam? wouldnt adam's children be born the way adam was created, or not?
And your analysis is flat out lacking. What everyone else seems to realize is that the reason Obama won is because of FAR higher turnout, many by African American voters. (Who more tend to be ... taa daa! ... Democrats!) There is definitely a considerable discrepancy in Obama supporters and gay marriage supporters. Of that, there can be no doubt.   And your anaysis of the FL situation is completely removed from reality. FL requires a vote of over 60% for an amendment to pass. It wouldn't pass at 59%, let alone 50. So not only do you demonstrate a lack of even knowing what was needed there, it doesn't even fit as an apt comparison.
I think you present a good point, but part of the test here is to see how my post is reponded to; silence from certain people tells us things in inself.   So far it seems my initial estimation of the issue is about right- the idelogy being upheld helps some people ignore the effect the punitive policy imposes.
A slimey claim you cannot support as usual. In developed Nations, the U.S. is far down the list as has been posted on this very board at least 5 times. Those 'other' Nations also have far more crime and violent crime than the U.S.
And here our Government says:   Rights and Responsibilities
So sorry; I have a friend who works and lives in the D.C. area, but he has residency in Mass., because he owns a home there. And he was able to be married only because he owns a home there ?
thatisnt stupid, its what teh bible says. teh dinosaurs are heavier thatn humans so they sunk and humans foated. the arc protecid the rest ans they died later when humans kiled them tehy still see dinos today in congo so some survivd.
Well, I suppose that the reply it took me almost 5 minutes to type, a couple more to check and a couple to correct will not suffice now.
Why is that propoganda? It's exactly what you do.
Well, given that your term is a fabrication of the creationist's mind, I suppose you're right. Evolutionists don't actually exist. Therefore you could assign whatever traits you wanted to them, including dishonesty. Evolutionist is a term designed to cast evolution as a faith based notion. The problem is there is no faith in evolution, faith is a belief in something with no proof. Evolution has proof. Therefore it cannot be a faith based idea. A typical creationist attack is to misrepresent their target by creating a strawman of it. They then declare it is wrong and by proxy, the actual theory wrong. It's fundementally weak, but inline with a belief that is scientifically unsound.
Actually, not at all true. The organisms of the Cambrian look little like modern animals. It is only the major phyla that are recognized by the derived characteristics. For example, the cordates first arise in the early Cambrian, along with primitive inverebrates. You can safely say that no animal living today looks much like any living then. For example, there were no amphibians, no reptiles, no insects, no birds, and of course, no mammals.   Your shotgun approach isn't actually worth answering in any detail. It isn't even your work.
And how is your think group any different, you all think alike just as gun owners all think alike. So stop calling the kettle black.
You mean to tell me it's a falsehood??   I don't believe it.
Let's not confuse our readers. supersport is not saying it's evolution; he's saying that "evolutionists" say that it's evolution. It should be clear now to the readers that scientists recognized perfectly well that this is an example of plasticity.
No I don't think that tying your tubes is abortion. I only think abortion comes into play when there is actually cells forming to make a baby, and you get them scraped out, or abort a baby before or after the third trimester. Plus I heard that if you tie the tubes, when you decide you want a baby you can untie the tubes, to conceive a baby. But burning is another thing. But unless there is actual cells forming it is not abortion
Same thing happened in Rwanda. First they put the names of all Tutsis on lists. Then, the Hutu came around with machettes and took them off of the lists....permanently.
Then there's that state thaht wants to remove the use of BC and AD from the calendar. I guess they'll change it to some neutral like plus and minus numbers just to stay with the rest of the world....or maybe 2005 will change to 133,956,373,278.
There's absolutely no way in hell this could be legal in any sense. That California school got ***** slapped for expelling a student who had a gun off campus, beyond the jurisdictional reach of the school. So how can this school believe they can get away with such an insane policy?
Thank God. I too hope it doesn't keep going back and forth. While I live across the river in Parkville, Missouri, I used to live in Overland Park Kansas and went to school there. I think they are generally pretty good public schools, it's just the state school board that keeps effing everything up when they get some christonazis on board.
