Then a man who needs an artificial heart to survive is a new species of man. That is the analogy I gave, and you ignored.   In both cases; human and bacteria, before the advent of a human product, a particular group of individuals from each larger group would die off.   BUT along come a man-made invention that allows those certain portions to live on which otherwise would have died. In once case - nylon, the other, the artificial heart. You call this evolution.   Nor is it 'natural selection' at work either, as in both cases the thing that enabled them to survive was not natural. What you have advanced as a proof of evolution actually proves what? Natural what? I suppose people with cochlear implants are new species too because they've learnt to hear.   Another view of this nylon-eating-bug is given...   "Finally, Mr Cerutti is out of date about this new nylon digesting ability allegedly from a frame shift. New evidence shows that the ability was due to plasmids [e.g. K. Kato, et al., ?A plasmid encoding enzymes for nylon oligomer degradation: Nucleotide sequence analysis of pOAD2?, Microbiology (Reading) 141(10):2585?2590, 1995.] In fact, more than one species of bacteria have the ability, residing on plasmids. This suggests that the information probably already existed, and was just passed between different types of bacteria."   "All that would be needed to enable an enzyme to digest nylon is a mutation causing loss of specificity in a proteolytic (protein-degrading) enzyme. This may seem surprising? How would a loss of information create a new ability? Answer: enzymes are usually tuned very precisely to only one type of molecule (the substrate). Loss of information would reduce the effectiveness of its primary function, but would enable it to degrade other substrates, too. Since both nylon and proteins are broken down by breaking amide linkages, a change in a proteolytic enzyme could also allow it to work on nylon. If this process were continued, the result would be a general enzyme with a weakly catalytic effect on the hydrolysis of too many chemicals to be useful where much selectivity is required. To put it into perspective, acids and alkalis also catalyze many hydrolysis reactions, but they also lack specificity. Indeed, an inhibitor of a protein degrading enzyme also inhibits the action of the nylon degrading enzyme"   http://www.answersingenesis.org/home...e7-24-2000.asp   Talkorigins gave their usual doubletalk   "Whilst this particular case does not "prove" evolution, it is consistent with, and supportive of, the theory of biological evolution."   Why do they say this? Because it's still a bacteria. It's not like it suddenly became a large multi-cellular organism. But it might just prove that this bug was so well designed that it can cope with newer situations. One site does say that it, the bacteria, had the capability already within it of change ? not resultant in ?mutations?, but more like switching on previously dormant apparatus. http://members.tripod.com/aslodge/id89.htm   One poster on another forum summed the problem up like this...   " In order for species to advance there would have to be a net information gain, which isn't the case with nylon eating bacteria.   The bacteria gained the ability to digest nylon, therefore was able to survive in a new environment. Two distinct advantages   But, the bacteria lost its ability to survive in its old environment, eat its former diet and suffered a 98% loss in efficiency. Three disadvantages.   So by taking two steps forward and three steps backward, where is the net gain?   If nylon eating bacteria was "proof" of evolution, we would still be pond scum, but with the ability to digest whatever happened to become the primary food source."   http://www.christianforums.com/t52336
Like most things theists that statement is based on ignorance.
And that didn't have a thing to do with my point.
Well, kind of a boring thread, since everyone agrees, but since I'm new here, I may as well weigh in. Hubby and I have three grown kids and one teen. The grown ones all got the same going-to-college gifts. They got a safe car, a laptop, an emergency credit card, and a personal firearm. I felt this especially important for our daughters.
But I think that is the point. What if you didn't agree with the germ theory of disease? Does that mean that it shouldn't be taught in health classes in our schools? Should it be replaced by the bad humors of night air theory? But not everyone agrees with that theory either.
We don't live on carbon dioxide. We live from the energy stored in carbon compounds when we break them down.
And religious folk in the south used the Bible to justify enslavement of thousands or millions of blacks, and also to justify their treating blacks as mere property. I suppose (but am not familiar enough with all of the details to know for sure) that some even used the Bible to justify linching blacks.
If I am to believe in something even if it's scientific, I should be able to challenge the belief's of the person who's pushing it. If they don't believe in what they're selling, why should I.
Actually just as many atheist help the needy.   Of course a person would need to be open-minded to realize it. Here is one such atheist charity. If you were open-minded about such things then you would have learned that both Bill Gates and Warren Buffett, who have each individually made the two largest charitable donations in American history, are both atheist (Oops, bet that's gotta kill your argument, huh?) and they can rightly claim credit for spurring many other ultra-rich to also be charitable.   Ted Turner, the multi-billionaire, has also donated millions to others, and guess what grizzly6626, he's an atheist too!   George Soros, also a multi-billionaire, financier and philanthropist, has also donated millions and is also an atheist. The list goes on and on. You just don't hear about these people donating because they tend to do these things quietly, and not with a lot of *cough* religious *cough* fanfare.   Didn't mean to wake you up grizzly6626   BTW - many catholic charities are known to turn the needy away. I've heard many accounts about how when some people first got married back in the 1970s, that catholic charities wouldn't help them out because they were not "good, church-going catholics." Basically because they didn't go to church every week (and put in their money filled envelope) the Church didn't consider them worthy of help.   You see, it isn't because religion makes people morally better than atheism. Rather, it would be because churches often organize charitable activities and encourage their members to participate, while atheists, simply have no comparable social structure. It's not that churchgoers have a superior moral sentiment, just that because of their increased social structure they naturally have increased opportunity.   There are countless amounts of people who are atheist that donate from the heart. They do not 'band together' into groups like religions do, and they do not advertise their charitable works like religions do, but they donate from the heart just the same. Here is a partial list of many such individuals who just happen to also be atheist. But it goes MUCH further than that though. There are a few organizations formed by atheists for the sole purpose of donating to those in need. One such organization is called S.H.A.R.E. - Secular Humanist Aid and Relief Effort. Here is a recent story about them helping those in need. So, when someone ignorant and closed-minded like grizzly6626 tries to convince you that 'only religions' donate or help those in need, you will now know that it's simply not true, and that people from all beliefs, even those that don't believe in God, help others in need and donate from their hearts, because they know it's the right thing to do for their fellow man in need
Yeah, back in the Late 60, because The Black Panther Party was publicly armed, and had publicly advocated Offing the Pigs, our law makers granted the police the law that said it was illegal for anyone to transport any firearm within Ohio. They did it with the understanding that they would not abuse the privilege that was granted for their protection. Well, 40 years went by, and new officers seeing this law on the books started enforcing it. After all, why not, It is the law, and their is no excuse for the law! Period!   Well, Ohioans for Concealed Carry and a bunch of others, decided enough was enough, and contacted Ohio law makers who took it off the books because it wasn't being used, as agreed upon!
http://news.bbc.co.uk/1/hi/world/africa/4487756.stm
First of all rape is one of the most under-reported crimes so it makes sense that abortion due to rape/incest is also under-reported so that makes your assumptions and numbers off.But of course you are missing the whole point.You are not the one being raped so it isn't YOUR choice.I don't need you making choices for me or telling me what is and isn't good for my emotional health.If one gets raped and DOES NOT want to be pregnant who are you tell them they have to be? Abortion should be legal for everybody who wants one not just rape/incest victims,for the simple reason that no human being has the right to substain life by using the body of another why should a fetus have more rights than actual persons?
Yes, but we had no way to tell until we found them again, now had we?
What's your point? Of course they will be bound by Heller just as the courts are bound by Roe v. Wade. That point wasn't in dispute. As long as you're talking about 19th Century Second Amendment case law, I like The State v. Buzzard (1842).
my my you are up on the current events. Thanks for shedding light on this for everyone here.
If guns laws don't affect criminals then how do you explain the low rates of criminal gun use in nations like the UK?
This why we think you're a liar.   http://www.talkorigins.org/faqs/dino...teocalcin.html
Nobody I know sanctions adultery. There are already serious consequences built in against it. As far a same sex marriage, I know of nobody that is suggesting legal penalties for it unless one considers the refusal to legally recognize it a legal penalty. Certainly nobody has been jailed or fined for attempting such marriages. Privately performed ceremonies as such are not punished.
Largely, out of date. To paraphrase myself from earlier, the differences between 'then' and 'now' are as follows:   Increased availability and proficiency of viable alternatives for self-defence.   Increased availability and improved variety/design of handguns.   Different type of 'gun crime' - it is now largely opportunistic.   Today's government need not fear almost any citizens militia, unless absolutely overwhelming.   Today's government is less in need of a (potential) extra army to defend against foreign assault.   I may have missed some...
To each his own...if you got it - flaunt it. Think of all the pretty, fashionable gun rigs that would spawn. Darn sinjin, you might have to get an outfit to get a date Course if you carried concealed like say, Mike Hammer, you might have to get a bowler or little CS hat?   Think of all the jobs it would create. Leather workers. Engravers. Gun finishes. More stylish guns. Corner gun stores and ammo at the local grocery, mail order business and on and on and on.   "Posers"? That is about all there is in kalifornia now isn't it? It doesn't bother you to watch scantily clad women...or men, whatever your preference is; why would full free exercise of a right freely stated in the Constitution be any different?   Oh, and on topic, end the pathetic pleas of the brady cowards and howls from VPC calling for discrimination and getting sued for demanding a Starbucks or any other emporium banish a citizen exercising a right.
And you've been failing miserably, partly because your definition of "atheism" is asinine. Even most Christians would disagree with you.
Catholics have a different belief. The goal is to always save both mother and child. If the fetus dies during the attempt to save both, then that's what happens. For instance, with an ectopic pregnancy, the goal isn't to kill he fetus, the goal is to save both mother and fetus.
I think a more telling question would be, why the hell would you rather feel constantly threatened than feel safe? It seems completely idiotic to me.   Smiley
Wouldn't it be wonderful if every woman in the world had access to decent prenatal care, if every woman in the world could be guanateed safe childbirth, wouldn't it be wonderful?   The entire series is at:   http://www.nytimes.com/2009/05/10/opinion/10gift.html   And, if men had to suffer the torture of being in labor for a week and having their insides torn out, don't you think the male-centered world would truly care more about the welfare of women and children?
I think such a move would qualify as a recognized declaration of war.
Be wary of names. 'junk' DNA is not rubbish ... it's called 'junk' because we don't know entirely what it is used for... But just look at all the blank spaces on this post. They are nothing, but they are keeping the words in order.   Evolutionaries are putting too much faith in names of words - such as human embryonic 'gill slits'   or   'transitional' fossil
Or helpful.
maybe, but see, that does not match the materialist universe?
And certain versions of Mark:   15He said to them, “Go into all the world and preach the good news to all creation. 16Whoever believes and is baptized will be saved, but whoever does not believe will be condemned. 17And these signs will accompany those who believe: In my name they will drive out demons; they will speak in new tongues; 18they will pick up snakes with their hands; and when they drink deadly poison, it will not hurt them at all; they will place their hands on sick people, and they will get well.”   Are they mistakenly reading this?
Well since posting on this thread has died and this seems to me to be the most interesting atheistic theory, I want to get a bit of clarification.   First, what do you mean by being allowed to cease providing for it at any age, but never allowed to kill it? By this do you mean that to cease providing for during the first trimester is not killing it? Is that because it is not alive at that time?   If I follow you (and I'm not sure I do) should the mother be allowed to have the baby removed at some point during the third trimester, after which it must be kept alive (and perhaps put up for adoption)?
Do you think this resistance got their most useful weapons out of a normal store? Please don´t try such arguments without knowing about European history.
Actually the Apocrypha is made up of pre-Christian texts, and late 4th century is a bit of a stretch for the new testament, certainly all its component texts were widely accepted by the 2nd century. I don't whether it is "generally accepted" that the text was altered, it seems to me that you are projecting your own views based on the hypotheses of some scholars on to Biblical scholarship in general.
I'm not.   ---
Banning abortion is a tool with which to punish women you deem promiscuous or immoral and recreate through a police state a mythical golden age of christian virtue, got you.   The rest is just a cover story in the same way biblical creationists who want their religion brought into the school system advocate "intelligent design".   They call it "lying for baby Jesus".
Well said.   With this religion, the gap is very wide between the "average guy" and "authority", because their clergy is more involved in politics than the clergy of Christianity, or the Creator himself. It fits with more Democrats being evolutionists, and more Democrats favoring bigger domestic government.
would that be legaly owned guns, or criminals who have guns (and also ues guns) for there crimes? most Gang members have guns, if they are killed in a drive by shooting, is the gun responsable, or would it be the illegal activitys?
Since I was there, I'll give you an objective rundown:   1.) Dawkins didn't "crash" anything. He watched the movie without saying a word and participated in a Q&amp;A session with the producer at the end --a session that the producer deliberately started.   2.) There was no "sneaking" on any level. PZ, his daughter, and I all registered our names over the internet for the event and selected the option to have up to three guests come with us. We registered our real names, our real addresses, our real telephone numbers, and our real emails, and we all received confirmation emails approving our registration.   3.) What possible reason did they have to deny PZ a viewing of the film? Dawkins and I pressed the producer Mathis on this issue, and he said it was about money -- he wanted PZ to come back in a month and pay his $10. But this makes no sense. PZ was paid $1,200 for his interview. They thanked him for the interview in the credits. If money was a concern, they could have paid him $1,190 and given him a free reservation. Just the fact that he was in the film should have been enough to warrant a seat at a pre-screening event.   This all begs the question: What in God's name are they so bloody afraid of?
Stop trying to muddy the waters. I was talking about developed nations with lower murder rates. You suddenly bring Chicago into the debate- a city with open borders in a nation where guns are freely available. Even if gun control hasn't worked there it doesn't follow that gun laws can't work on a national level.
Genes transfered horizontally are as subject to selection as anyother form of gene. Once intergrated into the recieving genome they are simply one more heritable element and if they alter the phenotypes (many are either neutral or even inactivatee) then of course they are subject to selection. Why do you think otherwise? Remember that horizontal transfer is a rare event roughly on a par with ordinary mutations.
The tactics pro-lifers use make the Nazis look like the little league. I mean, seriously. The reason we are dealing with terrorism is because women have the right to the abortion procedure. Wow. Please give me one way those two things relate to each other.
Just like no one is really "for" abortions, but they think that it's the woman's right to decide. Maybe that's like when congress gave the President the right to decide to go to war, even when they were supposed to declare war.
You then cite the Wikipedia entry on Spencer:
Then you are just throwing around words without knowing what they mean. Instead you give me a link to a page of pseudoscience. Are those the ones who lied to you?
I do not argue so much the quality of llife of an individual woman but more for the quality of life, indeed of having access to life itself, of the children of the woman involved, because in many situations the concern and nurturance of a mother may be the only thing keeping children alive, especially in poor, war-torn nations that do not enjoy the relative wealth of the United States.
I don't understand your question. If law-abiding gun owners were overwhelming those who should not have access to guns, those who use guns unlawfully, I would be very pleased.   But, as far as I can see, the only goal of the gunners is to make sure that everyone has a gun, no matter how insane, no matter how stupid, no matter how incapable they may be to own such easy-to-use instruments of death.
The idea here is to demonstrate that the odds of them realizing the same Genesis is impossible. That is unless God came back again, spoke his word into a book through the scribblings of random religious scholars. If you accept that this is inevitable, you are delusional.   The most likely thing would be for humans to come up with an entirely different religious doctrine. I would be willing to bet that it would pass through polytheism into monotheism as more information became available and eventually we would end up right where we are now. The problem with this scenario is that evolution would probably never be confirmed since our biological history would not be apparent. We would come up with theories that God made us and perhaps even some screwballs would say we were all part of an experiment and were placed on the planet by our ancestors a couple hundred thousand years prior.
Just so you know Peach, the 167 death row inmates are now serving life in prison. At least that one who's not guilty might now have a chance to be free.
Can't say.
So indignities offered our citizens will be tolerated if dispensed in small doses?   Maybe we might educate the pirates what they should "know better" than to try.   My taxes pay to have a Navy presence around the world. Americans are American interests.
What's your claim? That the seasonal molt of arctic foxes is evolution or that it is not? As usual, your responses show muddled thinking.
NOt true,   California's ammendments are not doing as well as other states did. You are talking about a very liberal state. If it is decided that marriage is allowed by the courts, then you are talking about taking away rights people have been granted by the courts. I just don't think that will happen in Calf. much too liberal.
Either a gross misunderstanding or a gross misrepresentation of evolutionary theory.
I'm not aware that the police used violence in arresting any of the people discussed in this case. Besides, I'm not discussing personal morality here, I'm discussing what should be legal, and what is practical in a society where not everyone shares the same moral views. Government is there to apply limits to what is permitted, based on the will of the people.
So individual cells contract to move cytoplasm around and to transport oxygen within itself?
And SS is once again wrong. If you really believe that then try to tell your genes to give you tiger stripes which will be inherited by your children. Good luck.
And it's only wishful thinking that they haven't. You are in no better position than I am. You don't know anymore than I do. Science has admitted that antarctica was much warmer several thousand years ago...not only that but the following map shows that the continent was not frozen. And if it was not frozen several hundreds years ago....and it was not frozen 4-5,000 years ago, as it was stated on this next seal link, then it's pretty safe to say that animals and humans could have both been there in recent history (within a few thousand years.) I agree this is no proof that it was attached, however, it is proof that the weather/temperature was DRASTICALLY different on antarctica than science has admitted.....and there's got to be a reason for this drastic change in temperatures.   http://www.world-mysteries.com/sar_1.htm   http://news.nationalgeographic.com/n...ent-seals.html   In an Antarctic "ghost town," freeze-dried whiskers, skin, and bones provide evidence that the South Pole was a much warmer place not too long ago, a new study reveals.   "We thought, This is really strange. If they are elephant seals, what are they doing here?" Hall said.   The discovery, scientists say, is the first hard evidence for a warming period in the region between 2,300 and 1,100 years ago.   An earlier warming period, between 6,000 and 4,000 years ago, has been recognized by other researchers and is believed to have been widespread, at least throughout the Southern Hemisphere. (so widespread that there wasn't snow on the ground and it wasn't frozen over!)
That isn't my logic. My logic states that banning doctors would cause more deaths and our current system does. You are trying to debate that doctors are threatening withour realizing that they have great rewards as well. My logic is to look for the risk and reward and not just focus on one side of the debate.   Your logic was that since doctors cause deaths then they should be banned if guns are, correct? Then why isn't it also consistant with your logic to believe that we should ban food since food causes deaths?   So lets clairfy here, do you believe that guns have a better risk/reward than doctors? If you HAD to ban one which would it be? I await your sidestep of the question.   lol, now your comparing the Jews to current US gun issues? Why did you choose to do this? The risk-reward for Jews is different than the risk-reward for the US. Jews probably would have faired better if the Germans used Japanise gun control laws.
No. I never mentioned grades. You brought that one up. I'm saying that having guns on school campus isn't a good plan due to the high level of emotions in the area.
No, it's not an "inability" at all. It's a simple matter of you trying to take what IS a religious issue for many people and divorce it from religion altogether. That's not going to happen for many people.   And BTW, if you are going to refer to people as "Antis", at least be upfront about what you feel they are "anti-" toward. "Anti-gay?" "Anti-gay marriage?" What?   But behind that are deeper, more fundamental issues about what homosexuality IS and the morality of it. To many people who view homoseuxality as immoral, your movement seems to be trying to write immorality into law.
Sorry, but that's not in the Establishment Clause of the First Amendment. Try again.
Well it could mean simple instinct, and I think you will find it was only applied to animals with brains. EAM attributes "intelligence" even to bacteria and to corn plants, trees, jellyfish, single celled eukaryotes etc. If one is to consider intelligence the main driver of adaptation it must be omnipresent in living organisms - there is zero support for this concept.
But then, there also is absolutely no evidence for such an intelligence.
